{
  "$schema": "https://json-schema.org/draft/2020-12/schema",
  "$id": "urn:ethos:schema:crop-element-contract:1",
  "title": "Ethos crop_element v1 contract inventory",
  "description": "Contract inventory for the crop_element v1 source-bound CLI/Python contract. This validates inventory shape and vocabulary; Node, MCP, hosted, sandbox-backed, and foreign-adapter crop behavior remain explicitly blocked.",
  "type": "object",
  "required": [
    "schema_version",
    "contract",
    "status",
    "carrier",
    "cases",
    "diagnostic_cases",
    "explicit_blockers"
  ],
  "additionalProperties": false,
  "properties": {
    "schema_version": { "const": 1 },
    "contract": { "const": "crop_element.v1" },
    "status": { "const": "supported" },
    "carrier": { "const": "ethos crop_element" },
    "cases": {
      "type": "array",
      "minItems": 1,
      "items": {
        "type": "object",
        "required": [
          "name",
          "document",
          "element_id",
          "request",
          "descriptor",
          "rendering_status"
        ],
        "additionalProperties": false,
        "properties": {
          "name": { "$ref": "#/$defs/case_name" },
          "document": { "$ref": "#/$defs/repo_path" },
          "element_id": { "type": "string", "pattern": "^e[0-9]{6}$" },
          "request": { "$ref": "#/$defs/repo_path" },
          "descriptor": { "$ref": "#/$defs/repo_path" },
          "rendering_status": { "enum": ["descriptor_only", "rendered"] }
        }
      }
    },
    "diagnostic_cases": {
      "type": "array",
      "minItems": 1,
      "items": {
        "type": "object",
        "required": [
          "name",
          "surface",
          "expected_diagnostics"
        ],
        "additionalProperties": false,
        "properties": {
          "name": { "$ref": "#/$defs/case_name" },
          "surface": {
            "enum": [
              "descriptor_binding",
              "request_ref",
              "request_binding",
              "descriptor_ref"
            ]
          },
          "expected_diagnostics": {
            "type": "array",
            "minItems": 1,
            "items": { "$ref": "#/$defs/diagnostic_message" },
            "uniqueItems": true
          }
        }
      }
    },
    "explicit_blockers": {
      "type": "array",
      "minItems": 1,
      "items": { "type": "string", "minLength": 1 },
      "uniqueItems": true
    }
  },
  "$defs": {
    "case_name": { "type": "string", "pattern": "^[a-z0-9]+(?:-[a-z0-9]+)*$" },
    "diagnostic_message": {
      "enum": [
        "request_ref is missing",
        "request_ref does not match crop element request identity tuple",
        "descriptor must bind exactly one logical check id",
        "descriptor crop_ref does not match logical identity tuple",
        "descriptor text_sha256 does not match verification evidence",
        "document_fingerprint is missing",
        "request document_fingerprint does not match document fingerprint",
        "descriptor document_fingerprint does not match request",
        "request element_id does not match contract inventory case",
        "request element_id does not resolve in document",
        "resolved element is missing page",
        "descriptor page does not match resolved element",
        "resolved element is missing bbox",
        "resolved element bbox has non-positive area",
        "resolved element bbox exceeds page bounds",
        "descriptor bbox does not match resolved element",
        "request rendering does not match contract inventory case",
        "descriptor rendering_status does not match request"
      ]
    },
    "repo_path": { "type": "string", "minLength": 1, "pattern": "^[A-Za-z0-9_./-]+$" }
  }
}
